{
  "schema_version": "material-batch/1",
  "batch_id": "reference-smoke",
  "name": "Reference 接入验收示例",
  "documents": [
    {
      "document_id": "fin-statement",
      "revision": 1,
      "title": "辰澜云智 · 2026 年 9 月_银行流水",
      "engine": "finance",
      "formats": [
        "pdf"
      ],
      "pdf_mode": "searchable",
      "appearance": "digital",
      "payload": {
        "project": {
          "version": 1,
          "name": "辰澜云智 · 2026 年 9 月",
          "company": {
            "name": "辰澜云智科技（上海）有限公司",
            "taxId": "91310000SYNTH00001A",
            "account": "SYN-3100-8000-1026",
            "bank": "澄川银行上海科创支行（虚构）",
            "address": "上海市浦东新区云杉路 168 号（虚构地址）"
          },
          "openingBalance": 1250000,
          "bankName": "澄川银行",
          "accountSubject": "1002 银行存款 / 澄川银行",
          "incomeSubject": "6001 主营业务收入 / 技术服务",
          "expenseSubject": "6602 管理费用 / 服务费",
          "maker": "周宁",
          "reviewer": "许清",
          "cashier": "林悦",
          "transactions": [
            {
              "id": "tx-001",
              "title": "华京平台年度服务费",
              "direction": "income",
              "invoiceType": "增值税专用发票",
              "invoiceNo": "26312000000000000001",
              "date": "2026-09-01",
              "paymentDate": "2026-09-03",
              "paymentTime": "10:26:38",
              "paymentRef": "SYN202609030001",
              "voucherNo": "001",
              "counterparty": {
                "name": "华京智能制造有限公司",
                "taxId": "91310000SYNTH00002B",
                "account": "SYN-3100-8000-2098",
                "bank": "澄川银行上海科创支行（虚构）",
                "address": "上海市浦东新区云杉路 168 号（虚构地址）"
              },
              "items": [
                {
                  "id": "i1",
                  "name": "*信息技术服务*平台服务费",
                  "spec": "运维云平台 · 年度服务",
                  "unit": "项",
                  "quantity": 1,
                  "price": 180000,
                  "rate": 6
                },
                {
                  "id": "i2",
                  "name": "*信息技术服务*实施服务费",
                  "spec": "接口配置及上线支持",
                  "unit": "项",
                  "quantity": 1,
                  "price": 20000,
                  "rate": 6
                }
              ],
              "paid": 212000,
              "purpose": "2026 年度运维云平台服务费",
              "note": "服务期间：2026年9月1日至2027年8月31日。"
            },
            {
              "id": "tx-002",
              "title": "星垣云资源采购",
              "direction": "expense",
              "invoiceType": "增值税专用发票",
              "invoiceNo": "26312000000000000002",
              "date": "2026-09-02",
              "paymentDate": "2026-09-04",
              "paymentTime": "14:08:16",
              "paymentRef": "SYN202609040002",
              "voucherNo": "002",
              "counterparty": {
                "name": "星垣云计算有限公司",
                "taxId": "91310000SYNTH00003C",
                "account": "SYN-3100-8000-3316",
                "bank": "澄川银行上海科创支行（虚构）",
                "address": "上海市浦东新区云杉路 168 号（虚构地址）"
              },
              "items": [
                {
                  "id": "i3",
                  "name": "*信息技术服务*云资源服务费",
                  "spec": "生产环境 · 9月",
                  "unit": "月",
                  "quantity": 1,
                  "price": 35000,
                  "rate": 6
                }
              ],
              "paid": 37100,
              "purpose": "9月生产环境云资源服务费",
              "note": ""
            },
            {
              "id": "tx-003",
              "title": "锐图算法维护服务",
              "direction": "expense",
              "invoiceType": "普通发票",
              "invoiceNo": "26312000000000000003",
              "date": "2026-09-05",
              "paymentDate": "2026-09-07",
              "paymentTime": "09:15:02",
              "paymentRef": "SYN202609070003",
              "voucherNo": "003",
              "counterparty": {
                "name": "锐图智能软件有限公司",
                "taxId": "91310000SYNTH00004D",
                "account": "SYN-3100-8000-4428",
                "bank": "澄川银行上海科创支行（虚构）",
                "address": "上海市浦东新区云杉路 168 号（虚构地址）"
              },
              "items": [
                {
                  "id": "i4",
                  "name": "*信息技术服务*软件维护费",
                  "spec": "排产算法维护",
                  "unit": "年",
                  "quantity": 1,
                  "price": 12000,
                  "rate": 6
                }
              ],
              "paid": 6000,
              "purpose": "算法维护费首期付款",
              "note": "分期支付，剩余款项按约结算。"
            }
          ],
          "background": [
            {
              "id": "daily-d9a0f601-1",
              "title": "办公用品采购款",
              "category": "办公采购",
              "direction": "expense",
              "paymentDate": "2026-09-28",
              "paymentTime": "16:10:01",
              "paymentRef": "SYN20260928d9a0f6010001",
              "paid": 2118.61,
              "purpose": "办公用品采购款",
              "receiptBusiness": "普通汇兑",
              "receiptChannel": "企业网上银行",
              "counterparty": {
                "name": "云榆商贸有限公司",
                "account": "SYN-6200-9000-0001",
                "bank": "澄川银行城市服务支行（虚构）",
                "taxId": "SYNTHETIC",
                "address": ""
              }
            },
            {
              "id": "daily-d9a0f601-2",
              "title": "咨询服务款",
              "category": "其他客户回款",
              "direction": "income",
              "paymentDate": "2026-09-03",
              "paymentTime": "13:33:03",
              "paymentRef": "SYN20260903d9a0f6010002",
              "paid": 4000,
              "purpose": "咨询服务款",
              "receiptBusiness": "普通汇兑",
              "receiptChannel": "企业网上银行",
              "counterparty": {
                "name": "启棠商务有限公司",
                "account": "SYN-6200-9000-0011",
                "bank": "澄川银行城市服务支行（虚构）",
                "taxId": "SYNTHETIC",
                "address": ""
              }
            },
            {
              "id": "daily-d9a0f601-3",
              "title": "快递及物流费用",
              "category": "快递物流",
              "direction": "expense",
              "paymentDate": "2026-09-28",
              "paymentTime": "14:03:46",
              "paymentRef": "SYN20260928d9a0f6010003",
              "paid": 1981.49,
              "purpose": "快递及物流费用",
              "receiptBusiness": "普通汇兑",
              "receiptChannel": "企业网上银行",
              "counterparty": {
                "name": "林舟物流有限公司",
                "account": "SYN-6200-9000-0004",
                "bank": "澄川银行城市服务支行（虚构）",
                "taxId": "SYNTHETIC",
                "address": ""
              }
            },
            {
              "id": "daily-d9a0f601-4",
              "title": "办公用品采购款",
              "category": "办公采购",
              "direction": "expense",
              "paymentDate": "2026-09-14",
              "paymentTime": "13:18:56",
              "paymentRef": "SYN20260914d9a0f6010004",
              "paid": 109.85,
              "purpose": "办公用品采购款",
              "receiptBusiness": "普通汇兑",
              "receiptChannel": "企业网上银行",
              "counterparty": {
                "name": "云榆商贸有限公司",
                "account": "SYN-6200-9000-0001",
                "bank": "澄川银行城市服务支行（虚构）",
                "taxId": "SYNTHETIC",
                "address": ""
              }
            },
            {
              "id": "daily-d9a0f601-5",
              "title": "网络通信服务费",
              "category": "通信网络",
              "direction": "expense",
              "paymentDate": "2026-09-10",
              "paymentTime": "15:52:04",
              "paymentRef": "SYN20260910d9a0f6010005",
              "paid": 2332.15,
              "purpose": "2026-09 网络通信服务费",
              "receiptBusiness": "普通汇兑",
              "receiptChannel": "企业网上银行",
              "counterparty": {
                "name": "澜杉网络服务有限公司",
                "account": "SYN-6200-9000-0006",
                "bank": "澄川银行城市服务支行（虚构）",
                "taxId": "SYNTHETIC",
                "address": ""
              }
            },
            {
              "id": "daily-d9a0f601-6",
              "title": "快递及物流费用",
              "category": "快递物流",
              "direction": "expense",
              "paymentDate": "2026-09-28",
              "paymentTime": "15:13:12",
              "paymentRef": "SYN20260928d9a0f6010006",
              "paid": 3769.7,
              "purpose": "快递及物流费用",
              "receiptBusiness": "普通汇兑",
              "receiptChannel": "企业网上银行",
              "counterparty": {
                "name": "林舟物流有限公司",
                "account": "SYN-6200-9000-0004",
                "bank": "澄川银行城市服务支行（虚构）",
                "taxId": "SYNTHETIC",
                "address": ""
              }
            },
            {
              "id": "daily-d9a0f601-7",
              "title": "办公用品采购款",
              "category": "办公采购",
              "direction": "expense",
              "paymentDate": "2026-09-02",
              "paymentTime": "11:21:55",
              "paymentRef": "SYN20260902d9a0f6010007",
              "paid": 66.94,
              "purpose": "办公用品采购款",
              "receiptBusiness": "普通汇兑",
              "receiptChannel": "企业网上银行",
              "counterparty": {
                "name": "云榆商贸有限公司",
                "account": "SYN-6200-9000-0001",
                "bank": "澄川银行城市服务支行（虚构）",
                "taxId": "SYNTHETIC",
                "address": ""
              }
            },
            {
              "id": "daily-d9a0f601-8",
              "title": "转账结算手续费",
              "category": "银行手续费",
              "direction": "expense",
              "paymentDate": "2026-09-14",
              "paymentTime": "14:22:02",
              "paymentRef": "SYN20260914d9a0f6010008",
              "paid": 80.77,